{
  "kind": "analysis",
  "id": "9c7a20bdd90aa3cffe4c6ba8920cad1a",
  "inputDigest": "sha256:4faff93bf6a984be438efc09eee74722b04c289d09b5a598922bc10d9fc5c564",
  "inputs": {
    "design": {
      "field": "gf256",
      "matrix": [
        [
          "04",
          "06",
          "02",
          "02"
        ],
        [
          "01",
          "02",
          "03",
          "01"
        ],
        [
          "01",
          "01",
          "02",
          "03"
        ],
        [
          "03",
          "01",
          "01",
          "02"
        ]
      ],
      "model": "aes-like/gf256/v1",
      "offsets": [
        0,
        1,
        2,
        3
      ],
      "rounds": 4,
      "sbox": {
        "kind": "aes"
      },
      "width": 4
    },
    "target": "matrix"
  },
  "claims": [
    {
      "id": "matrix.mds",
      "chain": "design",
      "title": "Matrix is MDS (branch number 5)",
      "status": "proved",
      "evidence": {
        "kind": "lean",
        "label": "Lean-checked proof",
        "theorem": "CryptificateJob.matrix_mds",
        "type": "IsMDS CryptificateJob.candMatrix",
        "axioms": [
          "propext",
          "Classical.choice",
          "Quot.sound"
        ]
      },
      "witness": null,
      "note": "Lean checked CryptificateJob.matrix_mds using only the standard axioms."
    },
    {
      "id": "offsets.dispersion",
      "chain": "design",
      "title": "Row offsets are pairwise distinct",
      "status": "proved",
      "evidence": {
        "kind": "lean",
        "label": "Lean-checked proof",
        "theorem": "CryptificateJob.offsets_optimal",
        "type": "DiffusionOptimal (gridCol 4 4) (shiftRowsPerm 4 4 CryptificateJob.candOffsets)",
        "axioms": [
          "propext",
          "Classical.choice",
          "Quot.sound"
        ]
      },
      "witness": null,
      "note": "Lean checked CryptificateJob.offsets_optimal using only the standard axioms."
    },
    {
      "id": "sbox.bijective",
      "chain": "design",
      "title": "S-box is a permutation",
      "status": "proved",
      "evidence": {
        "kind": "lean",
        "label": "Lean-checked proof",
        "theorem": "CryptificateJob.sbox_bijective",
        "type": "Function.Bijective CryptificateJob.candSboxTable",
        "axioms": [
          "propext",
          "Classical.choice",
          "Quot.sound"
        ]
      },
      "witness": null,
      "note": "Lean checked CryptificateJob.sbox_bijective using only the standard axioms."
    },
    {
      "id": "activity.bound",
      "chain": "design",
      "title": "At least 25 active S-boxes over 4 rounds",
      "status": "proved",
      "evidence": {
        "kind": "lean",
        "label": "Lean-checked proof",
        "theorem": "CryptificateJob.activity_bound",
        "type": "∀ (sbox : GF256 → GF256), Function.Injective sbox → ∀ (keys : ℕ → Fin 16 → GF256) (x y : Fin 16 → GF256), x ≠ y → (CryptificateJob.candRounds / 4 * 25 + if 2 ≤ CryptificateJob.candRounds % 4 then 5 else 0) ≤ Cryptificate.activeSboxes CryptificateJob.candMatrix CryptificateJob.candOffsets sbox keys x y CryptificateJob.candRounds",
        "axioms": [
          "propext",
          "Classical.choice",
          "Quot.sound"
        ]
      },
      "witness": null,
      "note": "Lean checked CryptificateJob.activity_bound using only the standard axioms."
    },
    {
      "id": "circuit.equivalence",
      "chain": "implementation",
      "title": "Circuit computes the design matrix",
      "status": "not_established",
      "evidence": {
        "kind": "diagnostic",
        "label": "Unchecked diagnostic"
      },
      "witness": null,
      "note": "No circuit was submitted.",
      "reason": "not-run"
    },
    {
      "id": "native.correctness",
      "chain": "implementation",
      "title": "Generated Rust matches the reference",
      "status": "not_established",
      "evidence": {
        "kind": "diagnostic",
        "label": "Unchecked diagnostic"
      },
      "witness": null,
      "note": "No circuit was submitted.",
      "reason": "not-run"
    },
    {
      "id": "rust.refinement",
      "chain": "implementation",
      "title": "Rust kernel refines the Lean model",
      "status": "not_established",
      "evidence": {
        "kind": "diagnostic",
        "label": "Unchecked diagnostic"
      },
      "witness": null,
      "note": "No circuit was submitted.",
      "reason": "not-run"
    },
    {
      "id": "native.timing",
      "chain": "implementation",
      "title": "Native speed on this machine",
      "status": "not_established",
      "evidence": {
        "kind": "diagnostic",
        "label": "Unchecked diagnostic"
      },
      "witness": null,
      "note": "Timing is measured by experiments, not by an analysis.",
      "reason": "not-run"
    }
  ],
  "execution": {
    "state": "completed",
    "steps": [
      {
        "name": "validate",
        "state": "completed",
        "ms": 4
      },
      {
        "name": "diagnose",
        "state": "completed",
        "ms": 4
      },
      {
        "name": "emit-lean",
        "state": "completed",
        "ms": 4,
        "detail": "4 theorem(s)"
      },
      {
        "name": "lean",
        "state": "completed",
        "detail": "4/4 theorem(s) accepted",
        "ms": 3977
      },
      {
        "name": "native",
        "state": "skipped",
        "detail": "no circuit submitted"
      },
      {
        "name": "report",
        "state": "completed",
        "ms": 0
      }
    ]
  },
  "provenance": {
    "origin": "live",
    "checker": "cryptificate 0.1.0 (e74b8e6)",
    "toolchain": {
      "lean": "v4.33.1",
      "mathlib": "v4.33.1",
      "widetrail": "162c0f8a9e59841032ec5d66874fee31cf3b6298",
      "rustc": "rustc 1.97.0 (2d8144b78)"
    },
    "leanSourceSha256": "15976df5e6b0f211a30b92bfe704444b1915a476af43c414cad2452a20f07d6c",
    "cacheKey": "26c5d38ec6958a7a76560f6ed2ab7b6bbeded845ac84971e3563c1cefbbb0d11"
  }
}
