{
  "kind": "analysis",
  "id": "6101d58f105fa71d2e1d0416ddd3ea28",
  "inputDigest": "sha256:e55f3e07cf131691b0cd8aca16972ba3ea957bb50d043f3bd76de552b5171616",
  "inputs": {
    "design": {
      "field": "gf256",
      "matrix": [
        [
          "01",
          "00",
          "00",
          "00"
        ],
        [
          "00",
          "01",
          "00",
          "00"
        ],
        [
          "00",
          "00",
          "01",
          "00"
        ],
        [
          "00",
          "00",
          "00",
          "01"
        ]
      ],
      "model": "aes-like/gf256/v1",
      "offsets": [
        0,
        1,
        2,
        3
      ],
      "rounds": 4,
      "sbox": {
        "kind": "aes"
      },
      "width": 4
    },
    "program": {
      "field": "gf256",
      "instructions": [],
      "name": "identity",
      "outputs": [
        0,
        1,
        2,
        3
      ],
      "width": 4
    },
    "target": "matrix"
  },
  "claims": [
    {
      "id": "matrix.mds",
      "chain": "design",
      "title": "Matrix is MDS (branch number 5)",
      "status": "refuted",
      "evidence": {
        "kind": "lean",
        "label": "Lean-checked counterexample",
        "theorem": "CryptificateJob.matrix_not_mds",
        "type": "¬IsMDS CryptificateJob.candMatrix",
        "axioms": [
          "propext",
          "Classical.choice",
          "Quot.sound"
        ]
      },
      "witness": {
        "bound": 5,
        "input": [
          "01",
          "00",
          "00",
          "00"
        ],
        "inputWeight": 1,
        "kind": "branch",
        "output": [
          "01",
          "00",
          "00",
          "00"
        ],
        "outputWeight": 1
      },
      "note": "Lean checked a counterexample (CryptificateJob.matrix_not_mds)."
    },
    {
      "id": "offsets.dispersion",
      "chain": "design",
      "title": "Row offsets are pairwise distinct",
      "status": "proved",
      "evidence": {
        "kind": "lean",
        "label": "Lean-checked proof",
        "theorem": "CryptificateJob.offsets_optimal",
        "type": "DiffusionOptimal (gridCol 4 4) (shiftRowsPerm 4 4 CryptificateJob.candOffsets)",
        "axioms": [
          "propext",
          "Classical.choice",
          "Quot.sound"
        ]
      },
      "witness": null,
      "note": "Lean checked CryptificateJob.offsets_optimal using only the standard axioms."
    },
    {
      "id": "sbox.bijective",
      "chain": "design",
      "title": "S-box is a permutation",
      "status": "proved",
      "evidence": {
        "kind": "lean",
        "label": "Lean-checked proof",
        "theorem": "CryptificateJob.sbox_bijective",
        "type": "Function.Bijective CryptificateJob.candSboxTable",
        "axioms": [
          "propext",
          "Classical.choice",
          "Quot.sound"
        ]
      },
      "witness": null,
      "note": "Lean checked CryptificateJob.sbox_bijective using only the standard axioms."
    },
    {
      "id": "activity.bound",
      "chain": "design",
      "title": "At least 25 active S-boxes over 4 rounds",
      "status": "not_established",
      "evidence": {
        "kind": "diagnostic",
        "label": "Unchecked diagnostic"
      },
      "witness": null,
      "note": "Not established by this method: the bound needs the MDS property of the matrix to be proved first. This is not a refutation.",
      "reason": "precondition-failed"
    },
    {
      "id": "circuit.equivalence",
      "chain": "implementation",
      "title": "Circuit computes the design matrix",
      "status": "proved",
      "evidence": {
        "kind": "lean",
        "label": "Lean-checked circuit equivalence",
        "theorem": "CryptificateJob.circuit_equivalence",
        "type": "CryptificateJob.candProgram.WellFormed ∧ ∀ (x : Fin 4 → GF256), CryptificateJob.candProgram.eval x = CryptificateJob.candMatrix.mulVec x",
        "axioms": [
          "propext",
          "Classical.choice",
          "Quot.sound"
        ]
      },
      "witness": null,
      "note": "Lean checked CryptificateJob.circuit_equivalence using only the standard axioms."
    },
    {
      "id": "native.correctness",
      "chain": "implementation",
      "title": "Generated Rust matches the reference",
      "status": "proved",
      "evidence": {
        "kind": "native",
        "label": "Generated Rust passed 9214 correctness cases",
        "cases": 9214
      },
      "witness": null,
      "note": "Generated Rust matched the independently computed matrix product on all 9214 test vectors. This is testing, not a proof."
    },
    {
      "id": "rust.refinement",
      "chain": "implementation",
      "title": "Rust kernel refines the Lean model",
      "status": "not_established",
      "evidence": {
        "kind": "diagnostic",
        "label": "Unchecked diagnostic"
      },
      "witness": null,
      "note": "The refinement proofs have not been checked on this machine (scripts/setup.sh --with-refinement).",
      "reason": "out-of-scope"
    },
    {
      "id": "native.timing",
      "chain": "implementation",
      "title": "Native speed on this machine",
      "status": "not_established",
      "evidence": {
        "kind": "diagnostic",
        "label": "Unchecked diagnostic"
      },
      "witness": null,
      "note": "Timing is measured by experiments, not by an analysis.",
      "reason": "not-run"
    }
  ],
  "execution": {
    "state": "completed",
    "steps": [
      {
        "name": "validate",
        "state": "completed",
        "ms": 4
      },
      {
        "name": "diagnose",
        "state": "completed",
        "ms": 4
      },
      {
        "name": "emit-lean",
        "state": "completed",
        "ms": 4,
        "detail": "4 theorem(s)"
      },
      {
        "name": "lean",
        "state": "completed",
        "detail": "4/4 theorem(s) accepted",
        "ms": 2908
      },
      {
        "name": "native",
        "state": "completed",
        "ms": 291
      },
      {
        "name": "report",
        "state": "completed",
        "ms": 0
      }
    ]
  },
  "provenance": {
    "origin": "live",
    "checker": "cryptificate 0.1.0 (e74b8e6)",
    "toolchain": {
      "lean": "v4.33.1",
      "mathlib": "v4.33.1",
      "widetrail": "162c0f8a9e59841032ec5d66874fee31cf3b6298",
      "rustc": "rustc 1.97.0 (2d8144b78)"
    },
    "leanSourceSha256": "c2d02752e82088256f070a9efee18daf3eea271ff5c9bf2d42d1829791fcb533",
    "cacheKey": "3e71258a45fac11f72ce7fb02491e01ce0b71ff95be95bf853a447ac2c9aea72"
  }
}
