{
  "kind": "analysis",
  "id": "fe06f930a3fbde8c1ef468ec8ce10bef",
  "inputDigest": "sha256:bebdfa5462bb404ea88ecaba48d6b5d1dfc10bdc052f259a6055f49db9b9668f",
  "inputs": {
    "design": {
      "field": "gf256",
      "matrix": [
        [
          "02",
          "03",
          "01",
          "01"
        ],
        [
          "01",
          "02",
          "03",
          "01"
        ],
        [
          "01",
          "01",
          "02",
          "03"
        ],
        [
          "03",
          "01",
          "01",
          "02"
        ]
      ],
      "model": "aes-like/gf256/v1",
      "offsets": [
        0,
        1,
        1,
        3
      ],
      "rounds": 4,
      "sbox": {
        "kind": "aes"
      },
      "width": 4
    },
    "target": "matrix"
  },
  "claims": [
    {
      "id": "matrix.mds",
      "chain": "design",
      "title": "Matrix is MDS (branch number 5)",
      "status": "proved",
      "evidence": {
        "kind": "lean",
        "label": "Lean-checked proof",
        "theorem": "CryptificateJob.matrix_mds",
        "type": "IsMDS CryptificateJob.candMatrix",
        "axioms": [
          "propext",
          "Classical.choice",
          "Quot.sound"
        ]
      },
      "witness": null,
      "note": "Lean checked CryptificateJob.matrix_mds using only the standard axioms."
    },
    {
      "id": "offsets.dispersion",
      "chain": "design",
      "title": "Row offsets are pairwise distinct",
      "status": "refuted",
      "evidence": {
        "kind": "lean",
        "label": "Lean-checked counterexample",
        "theorem": "CryptificateJob.offsets_not_optimal",
        "type": "¬DiffusionOptimal (gridCol 4 4) (shiftRowsPerm 4 4 CryptificateJob.candOffsets)",
        "axioms": [
          "propext",
          "Quot.sound"
        ]
      },
      "witness": {
        "kind": "offset-collision",
        "offset": 1,
        "rows": [
          1,
          2
        ]
      },
      "note": "Lean checked a counterexample (CryptificateJob.offsets_not_optimal)."
    },
    {
      "id": "sbox.bijective",
      "chain": "design",
      "title": "S-box is a permutation",
      "status": "proved",
      "evidence": {
        "kind": "lean",
        "label": "Lean-checked proof",
        "theorem": "CryptificateJob.sbox_bijective",
        "type": "Function.Bijective CryptificateJob.candSboxTable",
        "axioms": [
          "propext",
          "Classical.choice",
          "Quot.sound"
        ]
      },
      "witness": null,
      "note": "Lean checked CryptificateJob.sbox_bijective using only the standard axioms."
    },
    {
      "id": "activity.bound",
      "chain": "design",
      "title": "At least 25 active S-boxes over 4 rounds",
      "status": "not_established",
      "evidence": {
        "kind": "diagnostic",
        "label": "Unchecked diagnostic"
      },
      "witness": null,
      "note": "Not established by this method: the bound needs distinct row offsets to be proved first. This is not a refutation.",
      "reason": "precondition-failed"
    },
    {
      "id": "circuit.equivalence",
      "chain": "implementation",
      "title": "Circuit computes the design matrix",
      "status": "not_established",
      "evidence": {
        "kind": "diagnostic",
        "label": "Unchecked diagnostic"
      },
      "witness": null,
      "note": "No circuit was submitted.",
      "reason": "not-run"
    },
    {
      "id": "native.correctness",
      "chain": "implementation",
      "title": "Generated Rust matches the reference",
      "status": "not_established",
      "evidence": {
        "kind": "diagnostic",
        "label": "Unchecked diagnostic"
      },
      "witness": null,
      "note": "No circuit was submitted.",
      "reason": "not-run"
    },
    {
      "id": "rust.refinement",
      "chain": "implementation",
      "title": "Rust kernel refines the Lean model",
      "status": "not_established",
      "evidence": {
        "kind": "diagnostic",
        "label": "Unchecked diagnostic"
      },
      "witness": null,
      "note": "No circuit was submitted.",
      "reason": "not-run"
    },
    {
      "id": "native.timing",
      "chain": "implementation",
      "title": "Native speed on this machine",
      "status": "not_established",
      "evidence": {
        "kind": "diagnostic",
        "label": "Unchecked diagnostic"
      },
      "witness": null,
      "note": "Timing is measured by experiments, not by an analysis.",
      "reason": "not-run"
    }
  ],
  "execution": {
    "state": "completed",
    "steps": [
      {
        "name": "validate",
        "state": "completed",
        "ms": 7
      },
      {
        "name": "diagnose",
        "state": "completed",
        "ms": 4
      },
      {
        "name": "emit-lean",
        "state": "completed",
        "ms": 4,
        "detail": "3 theorem(s)"
      },
      {
        "name": "lean",
        "state": "completed",
        "detail": "3/3 theorem(s) accepted",
        "ms": 3311
      },
      {
        "name": "native",
        "state": "skipped",
        "detail": "no circuit submitted"
      },
      {
        "name": "report",
        "state": "completed",
        "ms": 0
      }
    ]
  },
  "provenance": {
    "origin": "live",
    "checker": "cryptificate 0.1.0 (e74b8e6)",
    "toolchain": {
      "lean": "v4.33.1",
      "mathlib": "v4.33.1",
      "widetrail": "162c0f8a9e59841032ec5d66874fee31cf3b6298",
      "rustc": "rustc 1.97.0 (2d8144b78)"
    },
    "leanSourceSha256": "03e5c234932f393e2bd698126ce9258cafb21b7d8e6c3ac9e2e52b7b5895723c",
    "cacheKey": "93f4ac804d710efd1910cb137eb6d4b760d60df1206c2eb46b1ea67ce4be0c0a"
  }
}
